{
  "$schema": "./schemas/m12-runtime-cases.schema.json",
  "schemaVersion": "1.1.0",
  "stage": "M12",
  "candidateVersion": "0.0.0",
  "validationStatus": "partially-runtime-executed",
  "authorization": {
    "realRuntimeAuthorized": false,
    "packageProbeAuthorized": false,
    "environmentChangesAuthorized": false
  },
  "environment": {
    "requiredOs": "Linux",
    "requiredNativeProvider": "MIGraphX 2.15.0 with ROCm 7.2.1",
    "localOs": "Windows",
    "localNativeProviderAvailable": false,
    "localFakeNativeAvailable": true,
    "managedTargetFrameworks": ["net46", "net461", "net462", "net47", "net471", "net472", "net48", "net481", "netcoreapp3.1", "net5.0", "net6.0", "net7.0", "net8.0", "net9.0", "net10.0"]
  },
  "fixtures": [
    {
      "id": "m12-identity-float32-1x4",
      "kind": "onnx",
      "artifactStatus": "available",
      "fileName": "m2-identity-float32.onnx",
      "sha256": "0b6fa0302a08a3fccf375d8ce4f84b7da59ccfa742fc59a0baa5f31722ae75f9",
      "license": "Apache-2.0 project-generated fixture",
      "reference": "float32 input [0.25,-1,2,9] must return the same ordered values"
    },
    {
      "id": "m12-dynamic-identity-float32",
      "kind": "onnx",
      "artifactStatus": "available",
      "fileName": "m11-dynamic-identity-float32.onnx",
      "sha256": "83fbdfae497dd5a03620be5c16f05642a5d367295816ee5e448fd1731ff2993b",
      "license": "Apache-2.0 project-generated fixture",
      "reference": "batch values 1 and 2 must preserve shape metadata and exact identity output"
    },
    {
      "id": "m12-tensorflow-minimal",
      "kind": "tensorflow",
      "artifactStatus": "available",
      "fileName": "m12-tensorflow-minimal.pb",
      "sha256": "de8be9fda62bbbffb72ce46ac91426b336be60f882e227b6e71e1407c584740e",
      "license": "Apache-2.0 project-generated fixture",
      "reference": "A minimal supported TensorFlow graph with one input and one deterministic output"
    },
    {
      "id": "m12-quantization-calibration",
      "kind": "calibration-map",
      "artifactStatus": "available",
      "fileName": "m12-calibration-map.json",
      "sha256": "15f8698707b49e1c92021d833bc0b79c1455f777241e80a7e500619309eda1af",
      "license": "Apache-2.0 project-generated fixture",
      "reference": "Calibration entries must be forwarded without mutation and produce a reviewed numeric result"
    },
    {
      "id": "m12-no-artifact",
      "kind": "none",
      "artifactStatus": "not-required",
      "license": "Not applicable",
      "reference": "Lifecycle, callback registration, negative ownership, and context cases use no model artifact"
    }
  ],
  "review": {
    "candidateResultLabel": "runtime-candidate-executed-review-required",
    "promotionRule": "Only an independent review of a clean, authorized, source/package-bound record may promote a case to runtime-executed.",
    "promotionRecord": "runtime-support-policy.json",
    "historicalMapsRemainUnchanged": true
  },
  "cases": [
    {
      "id": "m12-shape-argument-factories",
      "area": "shape-argument",
      "publicSurface": "MIGraphXShape.CreateScalar/CreateWithStrides and MIGraphXArgument.CreateEmpty/Generate/Clone",
      "fixtureIds": ["m12-identity-float32-1x4"],
      "expectation": "success",
      "synchronizationBoundary": "factory and snapshot calls return synchronously",
      "copyBoundary": "typed host values and shape metadata are copied into independent managed snapshots",
      "resourceOwnership": "created arguments own native storage; shape snapshots do not borrow native memory",
      "iterations": 3,
      "timeoutSeconds": 120,
      "prerequisites": ["exact core package", "identity fixture", "verified native root"],
      "environmentChangeRequired": false,
      "localEvidence": "fake-native-executed",
      "officialEvidence": "runtime-deferred",
      "resultCriteria": "Scalar metadata is validated as a managed shape contract; native empty/generated arguments use the standard [1,4] fixture shape, while explicit-stride metadata remains an independent managed shape and clone values match.",
      "evidenceBoundary": "Native detached arguments require static standard packed shapes, so explicit-stride coverage is limited to managed shape metadata while native empty/generated/clone behavior is exercised with standard shapes."
    },
    {
      "id": "m12-argument-persistence-clone",
      "area": "shape-argument",
      "publicSurface": "MIGraphXArgument.Save/Load/Clone and MIGraphXArgumentCollection/MIGraphXParameterMap clone paths",
      "fixtureIds": ["m12-identity-float32-1x4"],
      "expectation": "success",
      "synchronizationBoundary": "Save/Load and clone return before the next managed access",
      "copyBoundary": "loaded and cloned arguments remain valid after source disposal",
      "resourceOwnership": "each loaded or cloned argument owns a new native handle and payload",
      "iterations": 3,
      "timeoutSeconds": 120,
      "prerequisites": ["exact core package", "record-local absolute payload path"],
      "environmentChangeRequired": false,
      "localEvidence": "fake-native-executed",
      "officialEvidence": "runtime-deferred",
      "resultCriteria": "Round-tripped argument values, cloned parameter maps, and cloned output collections remain exact after their source owners are disposed.",
      "evidenceBoundary": "Local focused coverage and the package-only candidate execute cloned argument, parameter-map, and output-collection readback after their source owners are disposed. Repeated official-provider ownership observations and promotion remain runtime-deferred."
    },
    {
      "id": "m12-assign-to-clone",
      "area": "lifecycle",
      "publicSurface": "MIGraphXTarget, MIGraphXCompileOptions, MIGraphXFileOptions, MIGraphXOnnxOptions, MIGraphXTfOptions, MIGraphXProgram, and quantization option Clone APIs",
      "fixtureIds": ["m12-no-artifact"],
      "expectation": "success",
      "synchronizationBoundary": "assign-to returns before the destination is exposed",
      "copyBoundary": "destination handle is independent from the source owner",
      "resourceOwnership": "destination is created before assign-to and disposed on every failure path",
      "iterations": 3,
      "timeoutSeconds": 120,
      "prerequisites": ["exact core package", "verified native root"],
      "environmentChangeRequired": false,
      "localEvidence": "fake-native-executed",
      "officialEvidence": "runtime-deferred",
      "resultCriteria": "Target, compile, file, ONNX, TensorFlow, program, and quantization-option clones remain usable after their source owners are disposed; the local path compiles a cloned program with cloned target/options and applies cloned quantization names, while the package candidate also covers compile/save flows.",
      "evidenceBoundary": "Local focused coverage disposes source owners before continuing to use target, compile, file, ONNX, TensorFlow, program, and quantization-option clones, including cloned program compilation and quantization-name forwarding. The package candidate covers compile/save flows with applicable clones; repeated official-provider ownership observations, exhaustive field equivalence, and provider failure cleanup remain runtime-deferred."
    },
    {
      "id": "m12-graph-parent-lease",
      "area": "graph",
      "publicSurface": "MIGraphXProgram.GetMainModule/CreateModule and MIGraphXModule/MIGraphXInstruction views",
      "fixtureIds": ["m12-identity-float32-1x4"],
      "expectation": "success",
      "synchronizationBoundary": "module/instruction access completes while the program lease is held",
      "copyBoundary": "borrowed graph metadata is copied before the native collection is released",
      "resourceOwnership": "graph views retain a program lease and cannot outlive the parent program",
      "iterations": 3,
      "timeoutSeconds": 120,
      "prerequisites": ["exact core package", "identity fixture", "compiled program"],
      "environmentChangeRequired": false,
      "localEvidence": "fake-native-executed",
      "officialEvidence": "runtime-deferred",
      "resultCriteria": "Main and child module printing plus original/cloned module collections remain usable across caller disposal of the parent program.",
      "evidenceBoundary": "The reviewed candidate printed the main and child module views and read both original/cloned module collection counts after caller disposal of the parent program. Borrowed graph metadata snapshots and independent migraphx_module_create ownership remain outside this evidence; the case is still runtime-deferred."
    },
    {
      "id": "m12-graph-editing",
      "area": "graph",
      "publicSurface": "MIGraphXModule.AddParameter/AddLiteral/AddAllocation/AddInstruction/AddReturn",
      "fixtureIds": ["m12-identity-float32-1x4"],
      "expectation": "success",
      "synchronizationBoundary": "each graph edit returns before the next edit or compile",
      "copyBoundary": "argument and shape inputs are copied or retained by documented parent leases",
      "resourceOwnership": "program owns edited graph state; managed views do not invent a module destroy owner",
      "iterations": 3,
      "timeoutSeconds": 120,
      "prerequisites": ["exact core package", "identity fixture", "compiled target"],
      "environmentChangeRequired": false,
      "localEvidence": "fake-native-executed",
      "officialEvidence": "runtime-deferred",
      "resultCriteria": "A managed add-zero graph containing parameter, literal, allocation, operation, and return edits compiles and exactly preserves the reviewed input values.",
      "evidenceBoundary": "The package-only candidate compiles and runs the edited add-zero graph and preserves the reviewed input values. The official record does not promote graph-editing semantics, and independent migraphx_module_create ownership remains excluded."
    },
    {
      "id": "m12-tensorflow-parse",
      "area": "tensorflow",